"Digging into data management in public‐funded, international research in digital humanities","Poole, Alex H. ;  Garwood, Deborah A.","Journal of the Association for Information Science and Technology, 2020-01, Vol.71 (1), p.84-97",,"Computer Science ;  Computer Science, Information Systems ;  Information Science & Library Science ;  Science & Technology ;  Technology",,,"Path‐breaking in theory and practice alike, digital humanities (DH) not only secures a larger public audience for humanities and social sciences research, but also permits researchers to ask novel questions and to revisit familiar ones. Public‐funded, international, and collaborative research in DH furthers institutional research missions and enriches networked knowledge. The Digging into Data 3 challenge (DID3) (2014–2016), an international and interdisciplinary grant initiative embracing big data, included 14 teams sponsored by 10 funders from four nations. A qualitative case study that relies on purposive sampling and grounded analysis, this article centers on the information practices of DID3 participants. Semistructured interviews were conducted with 53 participants on 11 of the 14 DID3 projects. The study explores how Data Management Plan requirements affect work practices in public‐funded DH, how scholars grapple with key data management challenges, and how they plan to reuse and share their data. It concludes with three recommendations and three directions for future research.",,,,ISSN: 2330-1635; EISSN: 2330-1643; DOI: 10.1002/asi.24213,,,"Hoboken, USA: John Wiley & Sons, Inc",,,,,,,Wiley Online Library; Scopus; Business Source Complete; Science Citation Index Expanded; Social Sciences Citation Index,,,,,,,,,https://ocul-crl.primo.exlibrisgroup.com/permalink/01OCUL_CRL/17erkeh/cdi_webofscience_primary_000619261100008CitationCount
Text analysis using deep neural networks in digital humanities and information science,"Suissa, Omri ;  Elmalech, Avshalom ;  Zhitomirsky‐Geffet, Maayan","Journal of the Association for Information Science and Technology, 2022-02, Vol.73 (2), p.268-287",,"Computer Science ;  Computer Science, Information Systems ;  Information Science & Library Science ;  Science & Technology ;  Technology",,,"Combining computational technologies and humanities is an ongoing effort aimed at making resources such as texts, images, audio, video, and other artifacts digitally available, searchable, and analyzable. In recent years, deep neural networks (DNN) dominate the field of automatic text analysis and natural language processing (NLP), in some cases presenting a super‐human performance. DNNs are the state‐of‐the‐art machine learning algorithms solving many NLP tasks that are relevant for Digital Humanities (DH) research, such as spell checking, language detection, entity extraction, author detection, question answering, and other tasks. These supervised algorithms learn patterns from a large number of “right” and “wrong” examples and apply them to new examples. However, using DNNs for analyzing the text resources in DH research presents two main challenges: (un)availability of training data and a need for domain adaptation. This paper explores these challenges by analyzing multiple use‐cases of DH studies in recent literature and their possible solutions and lays out a practical decision model for DH experts for when and how to choose the appropriate deep learning approaches for their research. Moreover, in this paper, we aim to raise awareness of the benefits of utilizing deep learning models in the DH community.",,,,ISSN: 2330-1635; EISSN: 2330-1643; DOI: 10.1002/asi.24544,,,"Hoboken, USA: John Wiley & Sons, Inc",,,,,,,Wiley Online Library; Scopus; Business Source Complete; Science Citation Index Expanded; Social Sciences Citation Index,,,,,,,,,https://ocul-crl.primo.exlibrisgroup.com/permalink/01OCUL_CRL/17erkeh/cdi_crossref_primary_10_1002_asi_24544
The conceptual ecology of digital humanities,"Poole, Alex H","Journal of documentation, 2017-01, Vol.73 (1), p.91-122",,"Archives & records ;  Bibliometrics ;  Celebrities ;  Coalescing ;  Collaboration ;  Computer Science ;  Computer Science, Information Systems ;  Computers ;  Core curriculum ;  Culture ;  Cyberinfrastructure ;  Digital curation ;  Digital humanities ;  Digitization ;  Diversity (Institutional) ;  Electronic Libraries ;  Epistemology ;  Grants ;  Hockey ;  Humanism ;  Humanities ;  Information Science & Library Science ;  Information technology ;  Initiatives ;  Interdisciplinarity ;  Lexicography ;  Libraries ;  Library Science ;  Library Services ;  Linguistics ;  Pedagogy ;  Personal computers ;  Pregnancy ;  Project management ;  Scholarly communication ;  Scholars ;  Science & Technology ;  Social networks ;  Social sciences ;  Stakeholders ;  Sustainability ;  Technology ;  Text analysis ;  Web 2.0 ;  Word Processing",,,"Purpose
The purpose of this paper is to dissect key issues and debates in digital humanities, an emerging field of theory and practice. Digital humanities stands greatly to impact the Information and Library Science (ILS) professions (and vice versa) as well as the traditional humanities disciplines.
Design/methodology/approach
This paper explores the contours of digital humanities as a field, touching upon fundamental issues related to the field’s coalescence and thus to its structure and epistemology. It looks at the ways in which digital humanities brings new approaches and sheds new light on manifold humanities foci.
Findings
Digital humanities work represents a vital new current of interdisciplinary, collaborative intellectual activity both in- and outside the academy; it merits particular attention from ILS.
Research limitations/implications
This paper helps potential stakeholders understand the intellectual and practical framework of the digital humanities and “its relationship” to their own intellectual and professional work.
Originality/value
This paper critically synthesizes previous scholarly work in digital humanities. It has particular value for those in ILS, a community that has proven especially receptive to the field, as well as to scholars working in many humanities disciplines. Digital humanities has already made an important impact on both LIS and the humanities; its impact is sure to grow.",,,,ISSN: 0022-0418; EISSN: 1758-7379; DOI: 10.1108/JD-05-2016-0065,,,BINGLEY: Emerald Publishing Limited,,,,,,,"Library & Information Science Abstracts (LISA); Computer Science Database; Scholars Portal Journals: Emerald Management 150 Collection; Scopus; Advanced Technologies & Aerospace Collection; Scholars Portal Journals: Emerald Management 120 Collection; Arts & Humanities Database; Art, Design & Architecture Collection (Proquest) (PQ_SDU_P3); Arts & Humanities Citation Index; Social Sciences Citation Index; Alma/SFX Local Collection; Scholars Portal Journals: Emerald",,,,,,,,,https://ocul-crl.primo.exlibrisgroup.com/permalink/01OCUL_CRL/17erkeh/cdi_emerald_primary_10_1108_JD-05-2016-0065
Digital humanities and digital social reading,"Rebora, Simone ;  Boot, Peter ;  Pianzola, Federico ;  Gasser, Brigitte ;  Herrmann, J. Berenike ;  Kraxenberger, Maria ;  Kuijpers, Moniek M. ;  Lauer, Gerhard ;  Lendvai, Piroska ;  Messerli, Thomas C. ;  Sorrentino, Pasqualina","Digital Scholarship in the Humanities, 2021-10, Vol.36 (Supplement_2), p.II230-II250",,"Arts & Humanities ;  Arts & Humanities - Other Topics ;  Humanities, Multidisciplinary ;  Linguistics ;  Social Sciences",,,"Prominent among the social developments that the web 2.0 has facilitated is digital social reading (DSR): onmany platforms there are functionalities for creating book reviews, 'inline' commenting on book texts, online story writing (often in the form of fanfiction), informal book discussions, book vlogs, and more. In this article, we argue that DSR offers unique possibilities for research into literature, reading, the impact of reading and literary communication. We also claim that in this context computational tools are especially relevant, makingDSRa field particularly suitable for the application of Digital Humanities methods. We draw up an initial categorization of research aspects of DSR and briefly examine literature for each category. Wedistinguish between studies on DSR that use it as a lens to study wider processes of literary exchange as opposed to studies for which the DSR culture is a phenomenon interesting in its own right. Via seven examples of DSR research, we discuss the chosen approaches and their connection to research questions in literary studies.",,,,ISSN: 2055-7671; EISSN: 2055-768X; DOI: 10.1093/llc/fqab020,,,OXFORD: Oxford Univ Press,,,,,,,CRKN Oxford University Press Current; Scopus; Arts & Humanities Citation Index; Social Sciences Citation Index,,,,,,,,,https://ocul-crl.primo.exlibrisgroup.com/permalink/01OCUL_CRL/17erkeh/cdi_webofscience_primary_000756289000022CitationCount
The Human Labor of Digital Humanities,"Hunter, E. B.","TDR : Drama review, 2024-03, Vol.68 (1), p.117-131",,Arts & Humanities ;  Theater,,,"At the institutional and individual level, interest is growing in theatre and performance studies digital humanities (DH) projects. Too often, this interest fizzles out in the leap from digital imaginings to production timelines that real people must execute (with real budgets). A thorough understanding of the labor structures that drive such projects is necessary in developing realistic, sustainable models of DH work.",,,,ISSN: 1054-2043; EISSN: 1531-4715; DOI: 10.1017/S1054204323000540,,,CAMBRIDGE: Cambridge Univ Press,,,,,,,Project MUSE; Cambridge Journals Online; Arts & Humanities Citation Index; Scholars Portal Journals: Cambridge Current,,,,,,,,,https://ocul-crl.primo.exlibrisgroup.com/permalink/01OCUL_CRL/17erkeh/cdi_webofscience_primary_001183780200009CitationCount
"Digital humanities e culture documentarie: un modello di analisi, valutazione, interpretazione","Vivarelli, Maurizio","AIB studi (Roma ), 2020-09, Vol.60 (3), p.553-589",,Culture ;  Digital humanities ;  digital humanties ;  disciplinary relationships ;  Libraries ;  Library and information science ;  lis ;  Media studies,,,"Questo contributo ha per oggetto l'analisi ed interpretazione delle relazioni disciplinari tra digital humanities e culture documentarie (bibliografia, biblioteconomia, documentazione, library and information science). Dopo una discussione del termine e del concetto di 'disciplina', vengono prese in esame alcune delle caratteristiche dei campi disciplinari oggetto della ricerca, e successivamente ne vengono valutati comparativamente i punti di intersezione e di contatto. Il paragrafo finale, dopo aver riepilogato gli esiti dell'analisi della letteratura utilizzata, propone alcune considerazioni generali, che riguardano principalmente un possibile atteggiamento interpretativo, panoramico ed olistico, riferito alla mutazione digitale in atto. Viene mostrata la necessità di una prospettiva teorica e metodologica convintamente transdisciplinare, che sappia muoversi in modo equilibrato e consapevole tra ampiezza dei cultural e media studies, rigore teoretico della filosofia e 'lunga durata' dei processi storici, tutti necessari per comprendere gli elementi di novità, soprattutto antropologici, distribuiti nell'infosfera. L'obiettivo è quello di favorire il superamento della percezione inquietante (weirdness) che gli effetti del potere computazionale delle macchine generano, e definire le condizioni di fondo per nuovi ambienti biblioteconomici e bibliotecari, capaci di interpretare le tensioni di un Antropocene oramai post-umano.",,,,ISSN: 2280-9112; EISSN: 2239-6152; EISSN: 2239-6144; DOI: 10.2426/aibstudi-12471,,,Rome: Associazione Italiana di Aeronautica,,,,,,,Library & Information Science Abstracts (LISA); Scopus; Open Access: Freely Accessible Journals by multiple vendors,,,,,,,,,https://ocul-crl.primo.exlibrisgroup.com/permalink/01OCUL_CRL/17erkeh/cdi_proquest_reports_2519879710
Digital Humanities e moda,Valentina Rossi,"Zonemoda journal (Online), 2020-12, Vol.10 (2), p.43-59",,archive ;  curatorial practices ;  digital humanities ;  fashion ;  virtual exhibitions,,,"To answer the question posed by the call: Could the pandemic, the pervasive use of the Web and the experimentation of Extended Reality technologies give a boost to fashion archives? it is necessary to undertake a analysis of different case studies that over the years have been confronted with Digital Humanities practices.The essay aims to outline a methodological lecture on museum and archival practices related to digital humanities. Since March 2020, museums and archives have accelerated the data restitution process and reinterpreted the functions of institutions through digital practices and virtual exhibitions - that do not aspire to replace the real ones - and demonstrating how these are placed on a different level of reading. They can certainly integrate with the museum and physical itinerary, but they can also take place independently of it. The debate on Digital Humanities and Virtual Exhibitions is now wide and articulated and one of its major authors, Jeffrey Schnapp, writes of Knowledge design: we find ourselves creating new forms of knowledge assuming the current conditions that contemporaneity offers us, while other critical perspectives are aimed at restoring the difference on the role of the document as such or on the method of construction and the impact of digital platforms",,,,EISSN: 2611-0563; DOI: 10.6092/issn.2611-0563/11838,,,University of Bologna,,,,,,,ROAD: Directory of Open Access Scholarly Resources,,,,,,,,,https://ocul-crl.primo.exlibrisgroup.com/permalink/01OCUL_CRL/17erkeh/cdi_doaj_primary_oai_doaj_org_article_87f16e02c75649949b3b1f382561b72f
DHQ: Digital Humanities Quarterly,"Risam, Roopika ;  Gil, Alex","Digital humanities quarterly, 2022, Vol.16 (2)",,,,,,,,,ISSN: 1938-4122; EISSN: 1938-4122,,,,,,,,,,"Scopus; ROAD: Directory of Open Access Scholarly Resources; Arts & Humanities Database; Art, Design & Architecture Collection (Proquest) (PQ_SDU_P3); Alma/SFX Local Collection",,,,,,,,,https://ocul-crl.primo.exlibrisgroup.com/permalink/01OCUL_CRL/17erkeh/cdi_scopus_primary_2_s2_0_85162807811
Library and information science and the digital humanities: Perceived and real strengths and weaknesses,"Koltay, Tibor","Journal of documentation, 2016-07, Vol.72 (4), p.781-792",,"Computer Science ;  Computer Science, Information Systems ;  Digital humanities ;  Digital turn ;  Epistemologies ;  Information Science & Library Science ;  Library and information science ;  Science & Technology ;  Strengths ;  Technology ;  Weaknesses",,,"Purpose - Library and information science (LIS) and the digital humanities are both interested in studying recorded information and often share institutional frameworks. The purpose of this paper is to go beyond outlining these similarities by examining the perceived and real strengths and weaknesses of both disciplines.
Design/methodology/approach - Epistemologies and methods of both disciplines are analysed, principally in the light of the growing importance of data-intensive research, taking into consideration that there is a tension about the academic status of these disciplines.
Findings - Epistemologies and methods of both disciplines are analysed, principally in the light of the growing importance of data-intensive research, taking into consideration that there is a tension about the academic status of these disciplines.
Originality/value - The paper intends to be an add-on to the recent discussions and the evolving body of knowledge about the relationship of these disciplines with the hope of indicating a possible new direction in the development of LIS.",,,,ISSN: 0022-0418; EISSN: 1758-7379; DOI: 10.1108/JDOC-01-2016-0008,,,BINGLEY: Emerald Group Publishing,,,,,,,"Computer Science Database; Scholars Portal Journals: Emerald Management 150 Collection; Scopus; Advanced Technologies & Aerospace Collection; Scholars Portal Journals: Emerald Management 120 Collection; Arts & Humanities Database; Art, Design & Architecture Collection (Proquest) (PQ_SDU_P3); Arts & Humanities Citation Index; Social Sciences Citation Index; Alma/SFX Local Collection; Scholars Portal Journals: Emerald",,,,,,,,,https://ocul-crl.primo.exlibrisgroup.com/permalink/01OCUL_CRL/17erkeh/cdi_crossref_primary_10_1108_JDOC_01_2016_0008
An associative text analyzer to facilitate effectiveness of exploring historical texts for digital humanities,"Chen, Chih-Ming ;  Chen, Xian-Xu","ASLIB JOURNAL OF INFORMATION MANAGEMENT, 2024-08",,"Computer Science ;  Computer Science, Information Systems ;  Information Science & Library Science ;  Science & Technology ;  Technology",,,"PurposeThis study aims to develop an associative text analyzer (ATA) to support users in quickly grasping and interpreting the content of large amounts of text through text association recommendations, facilitating the identification of the contextual relationships between people, events, organization and locations for digital humanities. Additionally, by providing text summaries, the tool allows users to link between distant and close readings, thereby enabling more efficient exploration of related texts.Design/methodology/approachTo verify the effectiveness of this tool in supporting exploration of historical texts, this study uses a counterbalanced design to compare the use of the digital humanities platform for Mr. Lo Chia-Lun's Writings (DHP-LCLW) with and without the ATA to assist in exploring different aspects of text. The study investigated whether there were significant differences in effectiveness for exploring textual contexts and technological acceptance as well as used semi-structured in-depth interviews to understand the research participants' viewpoints and experiences with the ATA.FindingsThe results of the experiment revealed that the effectiveness of text exploration using the DHP-LCLW with and without the ATA varied significantly depending on the topic of the text being explored. The DHP-LCLW with the ATA was found to be more suitable for exploring historical texts, while the DHP-LCLW without the ATA was more suitable for exploring educational texts. The DHP-LCLW with the DHP-LCLW was found to be significantly more useful in terms of perceived usefulness than the DHP-LCLW without the ATA, indicating that the research participants believed the ATA was more effective in helping them efficiently grasp the related texts and topics during text exploration.Practical implicationsThe study's practical implications lie in the development of an ATA for digital humanities, offering a valuable tool for efficiently exploring historical texts. The ATA enhances users' ability to grasp and interpret large volumes of text, facilitating contextual relationship identification. Its practical utility is evident in the improved effectiveness of text exploration, particularly for historical content, as indicated by users' perceived usefulness.Originality/valueThis study proposes an ATA for digital humanities, enhancing text exploration by offering association recommendations and efficient linking between distant and close readings. The study contributes by providing a specialized tool and demonstrating its perceived usefulness in facilitating efficient exploration of related texts in digital humanities.",,,,ISSN: 2050-3806; EISSN: 1758-3748; DOI: 10.1108/AJIM-01-2024-0014,,,Leeds: Emerald Group Publishing,,,,,,,Science Citation Index Expanded; Social Sciences Citation Index; Alma/SFX Local Collection; Scholars Portal Journals: Emerald,,,,,,,,,https://ocul-crl.primo.exlibrisgroup.com/permalink/01OCUL_CRL/17erkeh/cdi_webofscience_primary_001285452100001
Digital Humanities: Between Technological and Lived Time,"Atkinson, Paul ;  Flanagan, Tim","Studies in philosophy and education, 2024-04, Vol.43 (2), p.143-160",,Arts & Humanities ;  Education & Educational Research ;  Philosophy ;  Social Sciences,,,"The digital humanities have developed in concert with online systems that increase the accessibility and speed of learning. Whereas previously students were immersed in the fluidity of campus life, they have become suspended and drawn-into various streams and currents of digital pedagogy, which articulate new forms of epistemological movement, often operating at speeds outside the lived time and rhythm of human thought. When assessing learning technologies, we have to consider the degree to which they complement the rhythms immanent to human thought, knowledge, investigation, and experimentation.In this paper, we examine learning from a humanities perspective, arguing that reading, writing, and thinking are ways of learning underscored by various genres of movement that segue with or diverge from the movements inherent to digital technologies, especially those deployed in learning systems. Using the work of thinkers such as John Dewey and Michel Serres, we examine the importance of movement in dialogue, where to truly learn involves embedding oneself in the flow of thought, accepting the flexibility of concepts, and aligning oneself with a community of thinkers.",,,,ISSN: 0039-3746; EISSN: 1573-191X; DOI: 10.1007/s11217-023-09912-5,,,DORDRECHT: Springer Nature,,,,,,,Canadian Research Knowledge Network SpringerLink Current; Arts & Humanities Citation Index; Social Sciences Citation Index; Scholars Portal Journals: Springer,,,,,,,,,https://ocul-crl.primo.exlibrisgroup.com/permalink/01OCUL_CRL/17erkeh/cdi_webofscience_primary_001135991800001CitationCount
What contributes to a qualified digital humanities librarian and ideal digital humanities pedagogy? An exploratory qualitative study,"Yao, Wuyan ;  Xiao, Peng","The Journal of academic librarianship, 2022-11, Vol.48 (6), p.102524, Article 102524",,Academic libraries ;  Definition ;  Digital humanities librarian ;  Digital humanities pedagogy ;  Information Science & Library Science ;  Qualities ;  Science & Technology ;  Technology,,,"Various digital humanities (DH) methods are increasingly being incorporated into the curricula of higher education institutions and the research undertaken in these institutions. Through semi-structured interviews conducted with eight librarians from four universities, along with observation of their actual work and investigation of the library websites, this study explored these librarians' perceptions of DH pedagogy and their understandings about the role of “DH librarian.” The findings show that the role of a DH librarian can be seen as a liaison among different stakeholders, a group of specialists, or a collective title. The importance of humanities versus technical backgrounds and the practical skills a DH librarian needs to support DH pedagogy are discussed. The findings also indicate that an ideal practice of DH pedagogy requires balanced collaboration, a clear framework, a closer partnership, ample investment in human and technical resources, and high valuation of non-book scholarship.",,,,ISSN: 0099-1333; EISSN: 1879-1999; DOI: 10.1016/j.acalib.2022.102524,,,NEW YORK: Elsevier Inc,,,,,,,Scholars Portal Journals: Elsevier Backfile: Social Science; Scopus; CRKN Elsevier Additional Journals; Scholars Portal Journals: Elsevier Current; Social Sciences Citation Index,,,,,,,,,https://ocul-crl.primo.exlibrisgroup.com/permalink/01OCUL_CRL/17erkeh/cdi_webofscience_primary_000891669200002
The Human Labor of Digital Humanities: A Note from the Trenches of Fabula(b) Theatre + New Media Lab,"Hunter, E.B","TDR : Drama review, 2024-03, Vol.68 (1), p.117-131",,Audiences ;  Collaboration ;  Conferences ;  Design ;  Digital humanities ;  Digital media ;  Digital technology ;  Performing arts ;  Theater,,,"At the institutional and individual level, interest is growing in theatre and performance studies digital humanities (DH) projects. Too often, this interest fizzles out in the leap from digital imaginings to production timelines that real people must execute (with real budgets). A thorough understanding of the labor structures that drive such projects is necessary in developing realistic, sustainable models of DH work.",,,,ISSN: 1054-2043; EISSN: 1531-4715; DOI: 10.1017/S1054204323000540,,,Cambridge: Cambridge University Press,,,,,,,Scopus; Project MUSE; Cambridge Journals Online; Scholars Portal Journals: Cambridge Current,,,,,,,,,https://ocul-crl.primo.exlibrisgroup.com/permalink/01OCUL_CRL/17erkeh/cdi_scopus_primary_2_s2_0_85186648339
Digital Humanities and Buddhism,"Weiss, Alexis Nicole","Theological librarianship, 2020-10, Vol.13 (2), p.47-48",,buddhism ;  digital humanities ;  review,,,,,,,ISSN: 1937-8904; EISSN: 1937-8904; DOI: 10.31046/tl.v13i2.1932,,,American Theological Library Association,,,,,,,ROAD: Directory of Open Access Scholarly Resources,,,,,,,,,https://ocul-crl.primo.exlibrisgroup.com/permalink/01OCUL_CRL/17erkeh/cdi_doaj_primary_oai_doaj_org_article_83e08633f62c4fa5a119c312637f7624
