Distribution features and intellectual structures of digital humanities: A bibliometric analysis,"Wang, Qing","Journal of documentation, 2018-01, Vol.74 (1), p.223-246",,"Academic Achievement ;  Author productivity ;  Bibliometrics ;  Citation indexes ;  CiteSpace ;  Cocitation ;  Computer Science ;  Computer Science, Information Systems ;  Cultural factors ;  Cultural resources ;  Data Analysis ;  Design parameters ;  Digital cultural heritage ;  Digital history ;  Digital humanities ;  Digital literary ;  Documents ;  Humanities computing ;  Information Science & Library Science ;  Interdisciplinary aspects ;  Library and information services ;  Literary Criticism ;  Literature reviews ;  Networks ;  Periodicals ;  Productivity ;  Researchers ;  Science & Technology ;  Scientometrics ;  Statistical Analysis ;  Technology ;  Visualization ;  Visualization analysis ;  VOSviewer",,,"Purpose - The purpose of this paper is to conduct a retrospective bibliometric analysis of documents about digital humanities, an emerging but interdisciplinary movement. It examines the distribution of research outputs and languages, identifies the active journals and institutions, dissects the network of categories and cited references, and interprets the hot research topics.
Design/methodology/approach - The source data are derived from the Web of Science (WoS) core collection. To reveal the holistic landscape of this field, VOSviewer and CiteSpace as popular visualization tools are employed to process the bibliographic data including author, category, reference, and keyword. Furthermore, the parameter design of the visualization tools follows the general procedures and methods for bibliometric analysis.
Findings - There is an obviously rapid growth in digital humanities research. English is still the leading academic language in this field. The most influential authors all come from or have scientific relationships with Europe and North America, and two leading countries of which are the UK and USA. Digital humanities is the result of a dynamic dialogue between humanistic exploration and digital means. This research field is closely associated with history, literary and cultural heritage, and information and library science.
Research limitations/implications - This analysis relies on the metadata information extracted from the WoS database; however, some valuable literatures in the field of digital humanities may not be retrieved from the database owing to the inherent challenge of topic search. This study is also restricted by the scope of publications, the limitation regarding the source of data is that WoS database may have underrepresented publications in this domain.
Originality/value - The output of this paper could be a valuable reference for researchers and practitioners interesting in the knowledge domain of digital humanities. Moreover, the conclusions of this retrospective analysis can be deemed as the comparable foundation for future study.",,,,ISSN: 0022-0418; EISSN: 1758-7379; DOI: 10.1108/JD-05-2017-0076,,,BINGLEY: Emerald Group Publishing,,,,,,,"Library & Information Science Abstracts (LISA); Computer Science Database; Scholars Portal Journals: Emerald Management 150 Collection; Scopus; Advanced Technologies & Aerospace Collection; Scholars Portal Journals: Emerald Management 120 Collection; Arts & Humanities Database; Art, Design & Architecture Collection (Proquest) (PQ_SDU_P3); Social Sciences Citation Index; Alma/SFX Local Collection; Scholars Portal Journals: Emerald",,,,,,,,,https://ocul-crl.primo.exlibrisgroup.com/permalink/01OCUL_CRL/17erkeh/cdi_crossref_primary_10_1108_JD_05_2017_0076
Comparative Global—Digital—Humanities,"de Fremery, Wayne","History of humanities, 2024-03, Vol.9 (1), p.115-128",,,,,"This article investigates a technical and intellectual foundation of digital scholarship—digital copying—for how it might help us to think about frameworks for exploring the humanities, digital or otherwise, in comparative contexts. Two research projects are compared and contrasted to suggest how the investigation of copies and digital copying might formulate useful critical frames for global comparative humanities projects. Both projects employed the same artificial intelligence technologies, specifically deep learning tools, to copy documents from previous centuries, the Qisha canon (Qishazang 磧砂藏), a thirteen-/fourteenth-century Tripitaka produced in Southeast China, and the Capital Gazette (Hwangsŏng sinmun 皇城新聞), a late nineteenth-/early twentieth-century newspaper produced on the Korean peninsula. One project was conducted with monastics at Fo Guang Shan (佛光山) Monastery in Taiwan between 2017 and 2021, and the other with the National Library of (South) Korea in 2021.",,,,ISSN: 2379-3163; EISSN: 2379-3171; DOI: 10.1086/729078,,,The University of Chicago Press,,,,,,,University of Chicago Press Journals,,,,,,,,,https://ocul-crl.primo.exlibrisgroup.com/permalink/01OCUL_CRL/17erkeh/cdi_uchicagopress_journals_729078
Digital Humanities Und Die Romanische Literaturwissenschaft Der Autorschaftsstreit um den Lazarillo de tormes,"Rißler-Pipka, Nanette ;  Siegen","Romanische Forschungen, 2016-09, Vol.128 (3), p.316-342",,,,,"El debate sobre la autoría del Lazarillo de Tormes (1554) se emplea en este artículo para mostrar la utilización de métodos digitales en la filología románica. Mediante el ejemplo de las atribuciones autoriales del Lazarillo se
comparan los inicios de las humanidades digitales, la estilística de Spitzer y el »distant reading« de Moretti con un ejemplo actual. Los problemas del empleo incorrecto de métodos digitales y estadísticos en el análisis de textos literarios se
muestran a través del ejemplo de los trabajos de Luis Madrigal. Por el contrario, en este artículo se ha intentado presentar propuestas de análisis que no enfocan solamente la cuestión de la autoría, sino también otras cuestiones tanto estilísticas
como narrativas. Las herramientas usadas son »voyant-tools« y la estilometría con R.",,,,ISSN: 0035-8126; EISSN: 1864-0737; DOI: 10.3196/003581216819562166,,,Vittorio Klostermann Verlag GmbH,,,,,,,JSTOR Journals and Primary Sources; JSTOR,,,,,,,,,https://ocul-crl.primo.exlibrisgroup.com/permalink/01OCUL_CRL/17erkeh/cdi_ingenta_journals_klos_rofo_2016_00000128_00000003_art00002
Digital humanities and theatre studies: New perspectives on the early reception of Ibsen on the German stage,"Hanssen, Jens-Morten","Ibsen studies, 2018, Vol.18 (2)",,informasjonsteknologi (IT) ;  norsk drama ;  resepsjon ;  teaterproduksjon ;  teatervitenskap,,,,,,,ISSN: 1502-1866; EISSN: 1741-8720,,,,,,,,,,Scholars Portal Journals: Taylor & Francis SSH Collection; Taylor & Francis CRKN Social Science and Humanities,,,,,,,,,https://ocul-crl.primo.exlibrisgroup.com/permalink/01OCUL_CRL/17erkeh/cdi_norart_articles_999921778209502201
Digital Humanities—Ways Forward,"Charnow, Sally Debra ;  Horn, Jeff","Historical reflections, 2023-12, Vol.49 (3), p.1-55",,,,,,,,,ISSN: 0315-7997; EISSN: 1939-2419; DOI: 10.3167/hrrh.2023.490301,,,,,,,,,,Scopus; Gale Academic OneFile Select; Berghahn Journals,,,,,,,,,https://ocul-crl.primo.exlibrisgroup.com/permalink/01OCUL_CRL/17erkeh/cdi_scopus_primary_2_s2_0_85179969570
"Rappresentazione, organizzazione e trasmissione della conoscenza: Library and information science e digital humanities",Simona Turbanti,"AIB studi (Roma ), 2022-12, Vol.62 (3)",,digital humanities ;  knowledge organization ;  library and information science,,,"L’articolo prende spunto da due recenti lavori monografici che ricadono nello spettro delle digital humanities, entrambi pubblicati da Editrice bibliografica: il volume di Federico Meschini Oltre il libro: forme di testualità e digital humanities (2020) e quello di Francesca Tomasi Organizzare la conoscenza: digital humanities e web semantico: un percorso tra archivi, biblioteche e musei (2022). L’articolo si sofferma in particolare sui legami esistenti tra le istituzioni della memoria, le discipline del libro e del documento e il ‘potenziale’ che può derivare da progetti ideati e sviluppati in ambiente digitale.",,,,ISSN: 2280-9112; EISSN: 2239-6152; DOI: 10.2426/aibstudi-13808,,,Associazione italiana biblioteche,,,,,,,Open Access: Freely Accessible Journals by multiple vendors,,,,,,,,,https://ocul-crl.primo.exlibrisgroup.com/permalink/01OCUL_CRL/17erkeh/cdi_doaj_primary_oai_doaj_org_article_0b3c1c4f57b84c32b0256abd3bf68984
Gender influences in Digital Humanities co-authorship networks,"Gao, Jin ;  Nyhan, Julianne ;  Duke-Williams, Oliver ;  Mahony, Simon","Journal of documentation, 2022-12, Vol.78 (7), p.327-350",,"Bibliometrics ;  Co authorship ;  Coding ;  Community Relations ;  Computer Science ;  Computer Science, Information Systems ;  Conferences (Gatherings) ;  Correlation ;  Datasets ;  Digital Humanities ;  Educational Technology ;  Females ;  Feminism ;  Gender differences ;  Gender identity ;  Gender studies ;  Information science ;  Information Science & Library Science ;  Language Processing ;  Males ;  Metadata ;  Network analysis ;  Periodicals ;  Productivity ;  Researchers ;  Science & Technology ;  Statistical analysis ;  Statistical Studies ;  Technology ;  Verbal communication",,,"PurposeThis paper presents a co-authorship study of authors who published in Digital Humanities journals and examines the apparent influence of gender, or more specifically, the quantitatively detectable influence of gender in the networks they form.Design/methodology/approachThis study applied co-authorship network analysis. Data has been collected from three canonical Digital Humanities journals over 52 years (1966–2017) and analysed.FindingsThe results are presented as visualised networks and suggest that female scholars in Digital Humanities play more central roles and act as the main bridges of collaborative networks even though overall female authors are fewer in number than male authors in the network.Originality/valueThis is the first co-authorship network study in Digital Humanities to examine the role that gender appears to play in these co-authorship networks using statistical analysis and visualisation.",,,,ISSN: 0022-0418; EISSN: 1758-7379; DOI: 10.1108/JD-11-2021-0221,,,Leeds: Emerald Publishing Limited,,,,,,,"Library & Information Science Abstracts (LISA); Computer Science Database; Scholars Portal Journals: Emerald Management 150 Collection; Scopus; Advanced Technologies & Aerospace Collection; Scholars Portal Journals: Emerald Management 120 Collection; Arts & Humanities Database; Art, Design & Architecture Collection (Proquest) (PQ_SDU_P3); Social Sciences Citation Index; Alma/SFX Local Collection; Scholars Portal Journals: Emerald",,,,,,,,,https://ocul-crl.primo.exlibrisgroup.com/permalink/01OCUL_CRL/17erkeh/cdi_crossref_primary_10_1108_JD_11_2021_0221
JASIST special issue on digital humanities (DH),"Zeng, Marcia Lei ;  Sula, Chris Alen ;  Gracy, Karen F. ;  Hyvönen, Eero ;  Alves Lima, Vânia Mara","Journal of the Association for Information Science and Technology, 2022-02, Vol.73 (2), p.143-147",,"Computer Science ;  Computer Science, Information Systems ;  Information Science & Library Science ;  Science & Technology ;  Technology",,,,,,,ISSN: 2330-1635; EISSN: 2330-1643; DOI: 10.1002/asi.24584,,,"Hoboken, USA: John Wiley & Sons, Inc",,,,,,,Wiley Online Library; Scopus; Business Source Complete; Science Citation Index Expanded; Social Sciences Citation Index,,,,,,,,,https://ocul-crl.primo.exlibrisgroup.com/permalink/01OCUL_CRL/17erkeh/cdi_webofscience_primary_000705043900001
Code review in digital humanities,"Damerow, Julia ;  Koeser, Rebecca Sutton ;  Carver, Jeffrey C. ;  Vogl, Malte","Digital Scholarship in the Humanities, 2024-09",,"Arts & Humanities ;  Arts & Humanities - Other Topics ;  Humanities, Multidisciplinary ;  Linguistics ;  Social Sciences",,,"Software and computational methods offer tremendous possibilities for digital humanities research, both accelerating existing work and opening up entirely new questions. However, software also has the potential to introduce new kinds of errors into the research workflow. How do we know that the software developed for a digital humanities project is error free and does what we think it does? Code review is a widespread technique to improve software quality and reduce the number of flaws, where a programmer other than the author reviews and comments on the source code. However, given that many digital humanities developers work in developer teams of one, code review is often not possible. In this article, we share progress and insights from an effort to establish a community code review process for digital humanities, and provide background to help understand the need and potential impacts of this work.",,,,ISSN: 2055-7671; EISSN: 2055-768X; DOI: 10.1093/llc/fqae052,,,OXFORD: Oxford Univ Press,,,,,,,CRKN Oxford University Press Current; Arts & Humanities Citation Index; Social Sciences Citation Index,,,,,,,,,https://ocul-crl.primo.exlibrisgroup.com/permalink/01OCUL_CRL/17erkeh/cdi_webofscience_primary_001322107200001CitationCount
3 Digital Humanities,"Roy, Dibyadyuti ;  Deshbandhu, Aditya","The year's work in critical and cultural theory, 2023, Vol.31 (1), p.45-60",,,,,,,,,ISSN: 1077-4254; EISSN: 1471-681X,,,,,,,,,,CRKN Oxford University Press Current; Scopus,,,,,,,,,https://ocul-crl.primo.exlibrisgroup.com/permalink/01OCUL_CRL/17erkeh/cdi_scopus_primary_2_s2_0_85171280357
Explaining digital humanities by aligning images and textual descriptions,"Cornia, Marcella ;  Stefanini, Matteo ;  Baraldi, Lorenzo ;  Corsini, Massimiliano ;  Cucchiara, Rita","Pattern recognition letters, 2020-01, Vol.129, p.166-172",,"Algorithms ;  Computer Science ;  Computer Science, Artificial Intelligence ;  Computer vision ;  Cultural heritage ;  Datasets ;  Descriptions ;  Digital humanities ;  Digital imaging ;  Domains ;  Embedding ;  Human performance ;  Language ;  Natural language processing ;  Replication ;  Science & Technology ;  Semantics ;  Semi-supervised learning ;  Sentences ;  Technology ;  Training ;  Visual-semantic retrieval",,,"•We propose semi-supervised visual-semantic models for the Digital Humanities domain.•Our approaches can align artistic images and text without paired supervision.•We transfer the knowledge learned on ordinary dataset to the artistic domain.•Experiments demonstrate the effectiveness of our distribution alignment strategy.
Replicating the human ability to connect Vision and Language has recently been gaining a lot of attention in the Computer Vision and the Natural Language Processing communities. This research effort has resulted in algorithms that can retrieve images from textual descriptions and vice versa, when realistic images and sentences with simple semantics are employed and when paired training data is provided. In this paper, we go beyond these limitations and tackle the design of visual-semantic algorithms in the domain of the Digital Humanities. This setting not only advertises more complex visual and semantic structures but also features a significant lack of training data which makes the use of fully-supervised approaches infeasible. With this aim, we propose a joint visual-semantic embedding that can automatically align illustrations and textual elements without paired supervision. This is achieved by transferring the knowledge learned on ordinary visual-semantic datasets to the artistic domain. Experiments, performed on two datasets specifically designed for this domain, validate the proposed strategies and quantify the domain shift between natural images and artworks.",,,,ISSN: 0167-8655; EISSN: 1872-7344; DOI: 10.1016/j.patrec.2019.11.018,,,AMSTERDAM: Elsevier B.V,,,,,,,Scholars Portal Journals: Elsevier Backfile: Decision Sciences; Scopus; CRKN Elsevier Additional Journals; Scholars Portal Journals: Elsevier Backfile: Computer Science; Scholars Portal Journals: Elsevier Current; Science Citation Index Expanded,,,,,,,,,https://ocul-crl.primo.exlibrisgroup.com/permalink/01OCUL_CRL/17erkeh/cdi_proquest_journals_2352369015
Digital humanities at global scale,"Barbecho, Lidia Bocanegra ;  Muñoz, Salvador Ros ;  García, Elena González-Blanco ;  Toscano, Maurizio","Interdisciplinary science reviews, 2023-07, Vol.48 (3), p.446-459",,"bibliometrics ;  computational literary studies ;  DH areas of knowledge ;  DH impact ;  DH institutions ;  DH keywords ;  Digital humanities ;  Multidisciplinary Sciences ;  Science & Technology ;  Science & Technology - Other Topics ;  Social Sciences ;  Social Sciences - Other Topics ;  Social Sciences, Interdisciplinary",,,"The incorporation of the humanities into digital transformation processes resulted in the emergence of a new research field called digital humanities. This new field has its origin in the beginning of the second half of the twentieth century. From the research point of view, through the analysis of the scientific production of the main academic databases, we provide here an overview of the international panorama of digital humanities, looking at the main countries, institutions, areas of knowledge and leading topics in this discipline.",,,,ISSN: 0308-0188; EISSN: 1743-2790; DOI: 10.1080/03080188.2023.2193799,,,"London, England: SAGE Publications",,,,,,,Scopus; Scholars Portal Journals: Taylor & Francis S&T Collection; Sage CRKN Collection; Science Citation Index Expanded; Social Sciences Citation Index; Scholars Portal Journals: Sage,,,,,,,,,https://ocul-crl.primo.exlibrisgroup.com/permalink/01OCUL_CRL/17erkeh/cdi_scopus_primary_2_s2_0_85168118756
"DH, wir müssen reden! Eine Konversation über das Scheitern in den Digital Humanities","Wuttke, Ulrike ;  Kampkaspar, Dario ;  Müller-Laackman, Jonas ;  Lang, Sarah ;  Karcher, Stefan","Bibliothek Forschung und Praxis, 2024-04, Vol.48 (1), p.84-89",,Digital Humanities ;  error culture ;  failure ;  Fehlerkultur ;  project management ;  Projektmanagement ;  Scheitern,,,Das „Scheitern“ eines Projektes wird mit Verschwendung von Zeit und Geld in Verbindung gebracht. Doch wann ist ein Projekt wirklich gescheitert – und ist ein negatives Projektergebnis tatsächlich ein Problem? Die Autor:innen haben diese Fragen auf einem Panel der Jahrestagung „Digital Humanities im deutschsprachigen Raum 2023“ gestellt und mit dem Publikum diskutiert. Die Fragen wurden nicht abschließend geklärt – es zeigte sich im Gegenteil ein großer Diskussions- und Handlungsbedarf in den DH und über die Grenzen von Disziplinen hinweg.,,,,ISSN: 0341-4183; EISSN: 1865-7648; DOI: 10.1515/bfp-2024-0004,,,De Gruyter,,,,,,,De Gruyter OCUL2022; Scholars Portal Journals: De Gruyter OCUL Collection; Walter De Gruyter: Open Access Journals,,,,,,,,,https://ocul-crl.primo.exlibrisgroup.com/permalink/01OCUL_CRL/17erkeh/cdi_crossref_primary_10_1515_bfp_2024_0004
Communicating Uncertainty in Digital Humanities Visualization Research,"Panagiotidou, Georgia ;  Lamqaddam, Houda ;  Poblome, Jeroen ;  Brosens, Koenraad ;  Verbert, Katrien ;  Moere, Andrew Vande","IEEE transactions on visualization and computer graphics, 2023-01, Vol.29 (1), p.1-11",,Communication ;  Data analysis ;  Data visualization ;  Digital humanities ;  Humanities ;  review ;  Task analysis ;  Taxonomy ;  Trustworthiness ;  Uncertainty ;  Visualization,,,"Due to their historical nature, humanistic data encompass multiple sources of uncertainty. While humanists are accustomed to handling such uncertainty with their established methods, they are cautious of visualizations that appear overly objective and fail to communicate this uncertainty. To design more trustworthy visualizations for humanistic research, therefore, a deeper understanding of its relation to uncertainty is needed. We systematically reviewed 126 publications from digital humanities literature that use visualization as part of their research process, and examined how uncertainty was handled and represented in their visualizations. Crossing these dimensions with the visualization type and use, we identified that uncertainty originated from multiple steps in the research process from the source artifacts to their datafication. We also noted how besides known uncertainty coping strategies, such as excluding data and evaluating its effects, humanists also embraced uncertainty as a separate dimension important to retain. By mapping how the visualizations encoded uncertainty, we identified four approaches that varied in terms of explicitness and customization. This work contributes with two empirical taxonomies of uncertainty and it's corresponding coping strategies, as well as with the foundation of a research agenda for uncertainty visualization in the digital humanities. Our findings further the synergy among humanists and visualization researchers, and ultimately contribute to the development of more trustworthy, uncertainty-aware visualizations.",,,,ISSN: 1077-2626; EISSN: 1941-0506; DOI: 10.1109/TVCG.2022.3209436; PMID: 36166561; CODEN: ITVGEA,,,United States: IEEE,,,,,,,IEEE Electronic Library Online,,,,,,,,,https://ocul-crl.primo.exlibrisgroup.com/permalink/01OCUL_CRL/17erkeh/cdi_scopus_primary_2_s2_0_85139484761
Digital humanities as a cross‐disciplinary battleground: An examination of inscriptions in journal publications,"Ma, Rongqian ;  Li, Kai","Journal of the Association for Information Science and Technology, 2022-02, Vol.73 (2), p.172-187",,"Computer Science ;  Computer Science, Information Systems ;  Information Science & Library Science ;  Science & Technology ;  Technology",,,"Inscriptions are defined as traces of scientific research production that are embodied in material artifacts and media, which encompass a wide variety of nonverbal forms such as graphs, diagrams, and tables. Inscription serves as a fundamental rhetorical device in research outputs and practices. As many inscriptions are deeply rooted in a scientific research paradigm, they can be used to evaluate the level of scientificity of a scientific field. This is specifically helpful to understand the relationships between research traditions in digital humanities (DH), a highly cross‐disciplinary between various humanities and scientific traditions. This paper presents a quantitative, community‐focused examination of how inscriptions are used in English‐language research articles in DH journals. We randomly selected 252 articles published between 2011 and 2020 from a representative DH journal list, and manually classified the inscriptions and author domains in these publications. We found that inscriptions have been increasingly used during the past decade, and their uses are more intensive in publications led by STEM authors comparing to other domains. This study offers a timely survey of the disciplinary landscape of DH from the perspective of inscriptions and sheds light on how different research approaches collaborate and combat in the field of DH.",,,,ISSN: 2330-1635; EISSN: 2330-1643; DOI: 10.1002/asi.24534,,,"Hoboken, USA: John Wiley & Sons, Inc",,,,,,,Wiley Online Library; Scopus; Business Source Complete; Science Citation Index Expanded; Social Sciences Citation Index,,,,,,,,,https://ocul-crl.primo.exlibrisgroup.com/permalink/01OCUL_CRL/17erkeh/cdi_wiley_primary_10_1002_asi_24534_ASI24534
Digital Humanities,"Mandal, Anthony","The year's work in critical and cultural theory, 2016, Vol.24 (1), p.317-342",,Culture ;  Humanities,,,"The digital humanities continue to grow within the academy, moving from earlier concentrations on tools development towards more sustained conceptual encounters with our increasingly digital culture. A number of recent publications have introduced the key terms of reference for digital humanistic practice to those unacquainted or uninitiated with current developments in the field.",,,,ISSN: 1077-4254; EISSN: 1471-681X,,,Oxford: Oxford Publishing Limited (England),,,,,,,CRKN Oxford University Press Current; Scopus; Scholars Portal Journals: Oxford Current,,,,,,,,,https://ocul-crl.primo.exlibrisgroup.com/permalink/01OCUL_CRL/17erkeh/cdi_scopus_primary_2_s2_0_84994220070
